{
    "success": true,
    "status": 200,
    "message": "Notes successfully retrieved",
    "data": [
        {
            "id": "6a16aafb53916b0295cdc6e6",
            "title": "Test Note 2_142d360c",
            "description": "Description 2",
            "category": "Work",
            "completed": false,
            "created_at": "2026-05-27T08:27:39.453Z",
            "updated_at": "2026-05-27T08:27:39.453Z",
            "user_id": "6a149c7e0389350296654f50"
        }
    ]
}